id,answer,content_score,relevance_score,vocabulary_score,structure_score,overall_score,label
1,Over the past four years I have built and scaled backend infrastructure for a high growth fintech startup. I led the migration of our monolithic system to microservices on AWS which reduced our mean time to recovery from hours to under fifteen minutes and cut infrastructure costs by thirty two percent. I have experience leading a team of eight engineers and working closely with product and business stakeholders to translate requirements into technical solutions. I believe my combination of hands on engineering capability and delivery leadership makes me well placed to help your platform team scale reliably.,5,5,4,4,4.6,Excellent
2,My seven years in digital marketing span agency and in-house roles across edtech and e-commerce. At my most recent role I led a cross-channel growth team that grew organic traffic by two hundred percent over eighteen months through a combination of technical SEO content strategy and link building. I also built and managed a performance marketing operation that achieved a return on ad spend of six point two. I understand both the creative and analytical dimensions of growth and believe I can build and lead a marketing function that drives measurable outcomes for your business.,5,5,4,4,4.6,Excellent
3,I have spent five years in data science with a focus on applied machine learning for consumer products. In my current role I built a personalization engine that improved click through rates by forty percent and increased average order value by twelve percent. I have experience with the full ML lifecycle from problem framing and data preparation through to deployment monitoring and iteration. I also enjoy translating technical findings into clear business narratives. I believe this combination of technical depth and communication ability makes me a strong candidate for your senior data science role.,5,5,4,4,4.6,Excellent
4,My career in supply chain management spans eight years with increasing responsibility across planning procurement and logistics. I led a supplier consolidation initiative that reduced vendor count by thirty five percent while improving on time delivery to ninety eight percent. I have also implemented an S&OP process that aligned manufacturing planning with commercial forecasts for the first time at my current company. I believe my track record of building operational systems and driving cross functional alignment will add significant value to your operations team.,5,5,4,4,4.6,Excellent
5,Over four years in product management I have launched three major products and several significant feature releases. My flagship product grew from zero to two hundred thousand active users in eighteen months by focusing relentlessly on solving a clearly defined problem for a specific user segment. I work comfortably across discovery research roadmapping and go to market planning. I also have experience managing stakeholder expectations across engineering design marketing and leadership. I am excited about the challenge your company is facing and believe I have the skills to lead your product towards its next growth phase.,5,5,4,5,4.75,Excellent
6,I have a decade of experience in civil and structural engineering having worked on residential commercial and infrastructure projects across three countries. In my most recent role I led the structural design and project delivery of a sixty story mixed use tower in Dubai. I managed a team of fifteen engineers coordinated with international consultants and maintained compliance with local regulatory requirements. I believe my experience managing large scale complex projects in demanding environments makes me well equipped to lead your engineering team.,5,5,4,4,4.6,Excellent
7,My background spans six years in management consulting at a global firm where I have served clients in financial services technology and industrial sectors. I have led more than twelve projects including two corporate strategy engagements for Fortune 500 companies. My work has resulted in measurable outcomes including a cost reduction of eighty million dollars for one client through a shared services implementation. I bring structured problem solving executive presence and the ability to manage complex stakeholder environments. I believe these skills are directly transferable to your strategic advisory team.,5,5,5,5,5.0,Excellent
8,I have spent five years as a machine learning engineer with a focus on natural language processing. At my current company I built a document classification system that reduced manual processing of legal documents by sixty percent saving approximately four hours per analyst per day. I have expertise in transformer architectures and have fine tuned large language models for domain specific tasks. I am also experienced in deploying models at scale using Kubernetes and maintaining them in production. I believe my applied NLP experience and production engineering skills will allow me to contribute quickly to your AI initiatives.,5,5,4,4,4.6,Excellent
9,My eight years in HR leadership have spanned talent acquisition learning and development and HR business partnering in technology companies ranging from early stage startups to a publicly listed company. I designed and implemented a leadership development program that directly contributed to a reduction in attrition among senior managers from twenty two to twelve percent. I believe in building HR systems that create measurable business impact rather than just fulfilling compliance requirements. I think my combination of strategic and operational HR experience is well matched to the scale and stage of your organization.,5,5,4,4,4.6,Excellent
10,I have seven years of experience in investment banking with a focus on mergers and acquisitions in the technology sector. I have advised on over twenty transactions including cross border deals totaling more than three billion dollars in enterprise value. In my current role I lead a sector coverage team and manage client relationships with technology companies across Southeast Asia. I am now looking to move to a corporate development role where I can apply my deal structuring and valuation expertise to drive your inorganic growth agenda.,5,5,5,4,4.9,Excellent
11,Over five years as a DevOps and platform engineering leader I have built cloud native infrastructure for companies at different stages of scale. I architected a zero downtime deployment system that enabled our team to ship code twelve times per day compared to twice per week before my joining. I have also built monitoring and observability frameworks that reduced our mean time to detect incidents by seventy percent. I believe my ability to combine infrastructure thinking with developer productivity focus will help your engineering team move faster with fewer outages.,5,5,4,4,4.6,Excellent
12,My six years in brand management at a consumer goods company have involved building and repositioning multiple brands. I led the relaunch of a legacy brand that resulted in a twenty eight percent increase in market share within twelve months through a combination of packaging redesign consumer research and integrated campaign execution. I have managed agency relationships media planning and innovation pipelines. I believe my experience driving brand results through data informed creativity makes me a strong fit for your brand leadership role.,5,5,4,4,4.6,Excellent
13,I have spent six years building data engineering capabilities at two companies. At my current role I designed and implemented a data lakehouse architecture on Databricks that reduced data processing latency from twelve hours to under thirty minutes. This enabled near real time dashboards for the executive team. I have also mentored junior engineers and established engineering standards for the data team. I believe my combination of architectural thinking and team leadership is what your growing data platform team needs.,5,5,4,4,4.6,Excellent
14,My background in finance spans eight years across corporate treasury risk management and financial planning. I implemented a cash flow forecasting model that improved forecast accuracy from sixty to ninety two percent enabling better investment decisions for a three thousand crore cash pool. I have also led interest rate and foreign exchange hedging programs for an export oriented company. I believe my quantitative financial skills and strategic treasury experience will strengthen your finance leadership team.,5,5,4,5,4.75,Excellent
15,I have six years of experience in cybersecurity engineering with specialization in cloud security and zero trust architecture. I led the design and implementation of a zero trust network access solution at my current company that replaced a legacy VPN infrastructure serving ten thousand users. Post implementation we saw a forty percent reduction in security incidents. I have also built a security champions program across engineering teams. I believe my ability to deliver security outcomes at enterprise scale is aligned with your stated security transformation goals.,5,5,4,4,4.6,Excellent
16,My seven years in sales leadership have been focused on enterprise SaaS. I built and scaled a sales team from six to twenty four representatives while growing annual recurring revenue from fifteen to one hundred and ten crore. I introduced a structured enterprise sales methodology that reduced average sales cycle length by thirty percent and improved win rates. I believe my track record in building high performing sales organizations and my deep understanding of the enterprise buying cycle make me an excellent fit for your VP of Sales role.,5,5,5,5,5.0,Excellent
17,I have spent five years at the intersection of strategy and technology working in digital transformation roles at a large industrial conglomerate. I led the deployment of an IoT based predictive maintenance platform across eleven plants which reduced unplanned downtime by twenty three percent and generated savings of approximately forty crore annually. I have worked with C suite stakeholders and managed cross functional teams of up to thirty people. I believe my ability to translate technology investment into operational value is precisely what your digital strategy team requires.,5,5,4,5,4.75,Excellent
18,My background in UX research and product design spans seven years across healthcare fintech and e-commerce. I established the research function at a health technology startup and built a research operations system that cut research cycle time in half while maintaining methodological rigor. My research directly influenced two major product pivots that together improved user activation by sixty percent. I believe my experience building research infrastructure and translating insights into product outcomes makes me a distinctive candidate for your design leadership role.,5,5,4,4,4.6,Excellent
19,I have nine years of experience in operations management in the pharmaceutical sector. I managed manufacturing operations for a sterile injectables plant and led a team of two hundred production and quality staff. Under my leadership we achieved and maintained US FDA registration for three consecutive inspection cycles. I also implemented lean manufacturing principles that improved overall equipment effectiveness from sixty two to seventy nine percent. I believe my operational track record and regulatory compliance experience are directly relevant to your plant director role.,5,5,4,5,4.75,Excellent
20,Over five years in growth and product marketing I have led go to market strategies for software products in the B2B SaaS space. I developed positioning and messaging frameworks that supported a series B fundraise and helped close our three largest enterprise accounts. I have built analyst relations programs presented at industry events and worked closely with sales to develop battle cards and competitive intelligence. I believe my ability to connect deep product understanding with compelling external narratives is a rare combination your marketing team would benefit from.,5,5,4,4,4.6,Excellent
21,I have seven years of experience in public policy and regulatory affairs working with government agencies think tanks and industry associations. I have represented private sector clients in stakeholder consultations drafted policy submissions and built coalitions around regulatory reform initiatives. In one engagement I led a coalition that successfully advocated for a licensing reform that opened a new market segment for three of our clients. I believe my understanding of the policy landscape and my ability to influence it will add a dimension to your government affairs team that is difficult to replicate.,5,5,5,5,5.0,Excellent
22,My five years in talent management and organizational development have focused on building leadership capability at critical organizational transitions. I designed a succession planning process for a company of eight hundred employees that increased internal promotion rates for senior roles from thirty to sixty percent within two years. I have also facilitated culture integration programs for two mergers. I believe my ability to build human capital systems that deliver measurable business outcomes is exactly what your people function needs at this stage of growth.,5,5,4,4,4.6,Excellent
23,I have spent six years in healthcare technology working on clinical data management and healthcare interoperability. I led the implementation of an HL7 FHIR based interoperability platform that connected three major hospital systems enabling data sharing for over four hundred thousand patients. This directly supported a population health management program that reduced preventable readmissions. I believe my unique combination of clinical domain knowledge and technical implementation experience will accelerate your health data initiatives.,5,5,4,4,4.6,Excellent
24,My background spans eight years in corporate finance with a focus on capital markets and structured finance. I have structured and executed debt instruments totaling over five billion dollars including high yield bonds project finance deals and hybrid instruments. I have worked with rating agencies banks and institutional investors and understand how to optimize capital structure for different business contexts. I believe my markets expertise and transaction experience will strengthen your capital markets advisory team significantly.,5,5,5,5,5.0,Excellent
25,I have six years of experience in environmental sustainability working with companies to measure and reduce their carbon footprint. I developed a science based target setting framework for a manufacturing company that aligned their emissions reduction roadmap with the Paris Agreement. I have also managed sustainability reporting for listed companies under GRI and TCFD frameworks. I believe my technical expertise in climate measurement and my ability to engage internal stakeholders make me a strong candidate for your sustainability leadership role.,5,5,4,4,4.6,Excellent
