id,answer,content_score,relevance_score,vocabulary_score,structure_score,overall_score,label
138,"I'm Amit, a Senior Backend Developer based in Mumbai. My expertise spans REST APIs, TensorFlow, Leadership, and React. I've spearheaded three major initiatives: Recommendation engine, which increased system efficiency by 40%, Mobile tracking application, delivering improved user experience significantly with 98% satisfaction, and Music streaming platform which optimized database performance by 60%. Each project enhanced my capabilities and contributed to organizational growth. I'm skilled in Problem Solving and possess deep knowledge of industry best practices. My strategic approach to problem-solving has consistently driven measurable outcomes. I'm actively pursuing a role as a Tech Lead, where I can leverage my experience to build exceptional products and lead transformative initiatives.",5,5,5,5,5.0,Excellent
139,"My name is Sneha, and I'm a Senior Business Analyst from Delhi. With a comprehensive skill set including Java, Web Development, and JavaScript, I've successfully delivered transformative solutions. I led the development of Real estate portal, which implemented enterprise-grade security standards. In parallel, I architected Real-time Chat application which reduced processing time by 50%. My contributions to Data visualization dashboard resulted in established industry best practices, significantly impacting our organization. Beyond technical expertise, I've mentored junior developers and established best practices across teams. I'm proficient in Excel and Statistics, ensuring robust and scalable solutions. My strategic vision aligns with becoming a CTO, where I can drive innovation and create lasting impact.",4,5,5,4,4.5,Excellent
140,"I'm Sanjay, a Electronics Engineering student based in Pune. My expertise spans Communication, Tableau, Leadership, and React. I've spearheaded three major initiatives: Customer analytics platform, which reduced processing time by 50%, Task management tool, delivering improved user experience significantly with 98% satisfaction, and Enterprise E-commerce platform which achieved 98% accuracy in predictions. Each project enhanced my capabilities and contributed to organizational growth. I'm skilled in Git and possess deep knowledge of industry best practices. My strategic approach to problem-solving has consistently driven measurable outcomes. I'm actively pursuing a role as a Engineering Manager, where I can leverage my experience to build exceptional products and lead transformative initiatives.",4,5,5,4,4.5,Excellent
141,"I'm Aryan, a Business Analyst with consulting experience based in Mumbai. My expertise spans Machine Learning, Docker, Project Management, and Kubernetes. I've spearheaded three major initiatives: Mobile tracking application, which increased system efficiency by 40%, Inventory management system, delivering improved user experience significantly with 98% satisfaction, and Customer analytics platform which received 5-star reviews from stakeholders. Each project enhanced my capabilities and contributed to organizational growth. I'm skilled in Statistics and possess deep knowledge of industry best practices. My strategic approach to problem-solving has consistently driven measurable outcomes. I'm actively pursuing a role as a Machine Learning Lead, where I can leverage my experience to build exceptional products and lead transformative initiatives.",5,5,5,4,4.85,Excellent
142,"Hello, I'm Varun, a Analytics professional from Pune. I have a strong foundation in Statistics, SQL, and Problem Solving. Throughout my career, I've successfully led multiple impactful projects. My flagship project Hospital management system implemented enterprise-grade security standards and currently serves thousands of users. Additionally, I developed Enterprise E-commerce platform which received recognition and promotion. I've also contributed to ML Weather forecasting app where I established industry best practices. My technical expertise extends to Excel and AWS. I'm passionate about VP Engineering and continuously seek opportunities to innovate and lead high-performing teams. I'm excited to bring my experience and vision to your organization.",5,4,5,5,4.75,Excellent
143,"I'm Divya, currently Masters in Business Administration in Kolkata. My professional expertise encompasses Scala, TensorFlow, Java, and Agile. I've led the conception and deployment of Student management portal, achieving received 5-star reviews from stakeholders. Simultaneously, I developed Supply chain management system, which mentored 5+ junior developers. I also spearheaded Customer analytics platform, resulting in saved company $500K annually. My commitment to continuous learning has made me proficient in Machine Learning. I'm recognized for my ability to translate complex requirements into elegant solutions. My career objective is to become a VP Engineering, where I can scale my impact and mentor emerging talent.",4,5,5,4,4.5,Excellent
144,"Hello, I'm Neha, a Computer Science student from Mumbai. I have a strong foundation in Tableau, AWS, and C++. Throughout my career, I've successfully led multiple impactful projects. My flagship project Music streaming platform received 5-star reviews from stakeholders and currently serves thousands of users. Additionally, I developed Real-time Chat application which received recognition and promotion. I've also contributed to Task management tool where I increased system efficiency by 40%. My technical expertise extends to Git and SQL. I'm passionate about Director of Engineering and continuously seek opportunities to innovate and lead high-performing teams. I'm excited to bring my experience and vision to your organization.",5,5,5,5,5.0,Excellent
145,"I'm Akshay, currently Associate Product Manager in Delhi. My professional expertise encompasses Project Management, Machine Learning, C++, and SQL. I've led the conception and deployment of ML Weather forecasting app, achieving mentored 5+ junior developers. Simultaneously, I developed Customer analytics platform, which saved company $500K annually. I also spearheaded Task management tool, resulting in handled 100,000 daily active users. My commitment to continuous learning has made me proficient in Excel. I'm recognized for my ability to translate complex requirements into elegant solutions. My career objective is to become a Machine Learning Lead, where I can scale my impact and mentor emerging talent.",4,5,5,5,4.65,Excellent
146,"My name is Pooja. I'm a Masters in Business Administration from Chennai with deep expertise in Excel, Data Analysis, and SQL. My career highlights include leading Music streaming platform which handled 100,000 daily active users, architecting Real-time Chat application that completed 2 months ahead of schedule, and spearheading Inventory management system which established industry best practices. I bring additional competency in Project Management and Communication, ensuring comprehensive technical excellence. My approach combines technical rigor with strategic thinking. I'm committed to becoming a CTO, where I can leverage my comprehensive skill set to drive organizational excellence and innovation.",4,5,5,4,4.5,Excellent
147,"Hi, I'm Swati, a Business Analyst with consulting experience from Bangalore. I excel in Web Development, TensorFlow, and HTML/CSS. My portfolio includes three standout projects: Inventory management system, where I achieved 98% accuracy in predictions, Supply chain management system which increased system efficiency by 40%, and Restaurant management system, delivering mentored 5+ junior developers. These experiences have solidified my expertise in Machine Learning and Python. I'm passionate about collaborative problem-solving and have consistently delivered results that exceed expectations. My vision for the future is to work as a Solutions Architect, where I can drive innovation at scale and shape industry standards.",5,5,4,4,4.6,Excellent
148,"My name is Aisha. I'm a MBA student from Gurugram with deep expertise in Python, Docker, and Web Development. My career highlights include leading Supply chain management system which scaled system to handle 10x traffic, architecting Scalable Blog platform that optimized database performance by 60%, and spearheading Task management tool which implemented enterprise-grade security standards. I bring additional competency in SQL and Leadership, ensuring comprehensive technical excellence. My approach combines technical rigor with strategic thinking. I'm committed to becoming a Senior Software Engineer, where I can leverage my comprehensive skill set to drive organizational excellence and innovation.",5,5,4,4,4.6,Excellent
149,"My name is Anjali. I'm a Quality Assurance Lead from Mumbai with deep expertise in Agile, Web Development, and TensorFlow. My career highlights include leading Supply chain management system which improved user experience significantly with 98% satisfaction, architecting Hospital management system that mentored 5+ junior developers, and spearheading ML classification model which implemented enterprise-grade security standards. I bring additional competency in Statistics and Tableau, ensuring comprehensive technical excellence. My approach combines technical rigor with strategic thinking. I'm committed to becoming a Solutions Architect, where I can leverage my comprehensive skill set to drive organizational excellence and innovation.",5,5,5,5,5.0,Excellent
150,"Hi, I'm Nikhil, a Computer Science student from Ahmedabad. I excel in Tableau, REST APIs, and AWS. My portfolio includes three standout projects: Real-time Chat application, where I improved user experience significantly with 98% satisfaction, Mobile tracking application which mentored 5+ junior developers, and Task management tool, delivering completed 2 months ahead of schedule. These experiences have solidified my expertise in Python and Android Development. I'm passionate about collaborative problem-solving and have consistently delivered results that exceed expectations. My vision for the future is to work as a Machine Learning Lead, where I can drive innovation at scale and shape industry standards.",5,5,4,5,4.75,Excellent
151,"I'm Rahul, a seasoned MBA student based in Chennai. I have comprehensive expertise in React, Project Management, Git, and REST APIs. I've successfully delivered Enterprise E-commerce platform, achieving saved company $500K annually, and Music streaming platform, which received recognition and promotion. My contribution to Scalable Blog platform resulted in improved user experience significantly with 98% satisfaction. My technical arsenal includes C++, and I'm known for my ability to mentor and elevate team performance. I'm pursuing a Senior Software Engineer position to expand my leadership impact and drive transformative change.",5,4,4,5,4.5,Excellent
152,"Hello, I'm Deepika, a Analytics professional with a track record of excellence in Kolkata. I've built strong proficiency in JavaScript, Problem Solving, and Node.js. Over my career, I've successfully completed ML classification model which established industry best practices, Recommendation engine resulting in implemented enterprise-grade security standards, and Scalable Blog platform which reduced processing time by 50%. My work has consistently demonstrated value, earning recognition from stakeholders. I'm competent in Communication and Machine Learning, with a systematic approach to technical challenges. I'm enthusiastic about transitioning into a Tech Lead role, where I can apply my technical depth and leadership skills to drive strategic initiatives.",5,5,5,5,5.0,Excellent
153,"Hello, I'm Sanjay, a CS major from Mumbai. My professional expertise encompasses Java, JavaScript, SQL, and HTML/CSS. I've led the successful execution of Student management portal, delivering received recognition and promotion. I also architected Recommendation engine, achieving handled 100,000 daily active users, and spearheaded Data visualization dashboard, which resulted in implemented enterprise-grade security standards. Beyond technical skills, I'm proficient in Scala and skilled at building high-performing teams. My next career milestone is a role as a Director of Engineering, where I can drive strategic initiatives and create sustainable value.",4,5,5,4,4.5,Excellent
154,"I'm Aryan, a Computer Science student based in Gurugram. My expertise spans Big Data, Scala, Web Development, and Docker. I've spearheaded three major initiatives: Real estate portal, which optimized database performance by 60%, Mobile tracking application, delivering implemented enterprise-grade security standards, and Inventory management system which handled 100,000 daily active users. Each project enhanced my capabilities and contributed to organizational growth. I'm skilled in Machine Learning and possess deep knowledge of industry best practices. My strategic approach to problem-solving has consistently driven measurable outcomes. I'm actively pursuing a role as a VP Engineering, where I can leverage my experience to build exceptional products and lead transformative initiatives.",5,5,5,5,5.0,Excellent
155,"Hi, I'm Karan, a Associate Product Manager from Kolkata. I excel in C++, JavaScript, and REST APIs. My portfolio includes three standout projects: Real-time Chat application, where I reduced processing time by 50%, Scalable Blog platform which scaled system to handle 10x traffic, and IoT sensor network, delivering increased system efficiency by 40%. These experiences have solidified my expertise in React and Communication. I'm passionate about collaborative problem-solving and have consistently delivered results that exceed expectations. My vision for the future is to work as a Senior Software Engineer, where I can drive innovation at scale and shape industry standards.",5,5,5,4,4.85,Excellent
156,"Hello, I'm Sneha, a Masters in Business Administration from Delhi. I have a strong foundation in Problem Solving, TensorFlow, and HTML/CSS. Throughout my career, I've successfully led multiple impactful projects. My flagship project IoT sensor network saved company $500K annually and currently serves thousands of users. Additionally, I developed Enterprise E-commerce platform which achieved 98% accuracy in predictions. I've also contributed to Mobile tracking application where I grew user base to 50,000 active users. My technical expertise extends to Excel and Kubernetes. I'm passionate about Principal Engineer and continuously seek opportunities to innovate and lead high-performing teams. I'm excited to bring my experience and vision to your organization.",5,5,5,5,5.0,Excellent
157,"Hi, I'm Harsh, a Senior QA Engineer from Hyderabad. I excel in Node.js, React, and Kubernetes. My portfolio includes three standout projects: Restaurant management system, where I improved user experience significantly with 98% satisfaction, Task management tool which increased system efficiency by 40%, and Inventory management system, delivering completed 2 months ahead of schedule. These experiences have solidified my expertise in SQL and Excel. I'm passionate about collaborative problem-solving and have consistently delivered results that exceed expectations. My vision for the future is to work as a Engineering Manager, where I can drive innovation at scale and shape industry standards.",5,4,5,5,4.75,Excellent
158,"Hello, I'm Ravi, a Senior Data Analyst from Bangalore. I have a strong foundation in Big Data, Excel, and Java. Throughout my career, I've successfully led multiple impactful projects. My flagship project Data visualization dashboard completed 2 months ahead of schedule and currently serves thousands of users. Additionally, I developed Enterprise E-commerce platform which increased system efficiency by 40%. I've also contributed to ML Weather forecasting app where I achieved 98% accuracy in predictions. My technical expertise extends to Project Management and JavaScript. I'm passionate about Engineering Manager and continuously seek opportunities to innovate and lead high-performing teams. I'm excited to bring my experience and vision to your organization.",5,5,4,5,4.75,Excellent
159,"I'm Varun, a seasoned Full Stack Developer based in Hyderabad. I have comprehensive expertise in Excel, Agile, Big Data, and Communication. I've successfully delivered Supply chain management system, achieving reduced processing time by 50%, and ML classification model, which completed 2 months ahead of schedule. My contribution to Enterprise E-commerce platform resulted in received recognition and promotion. My technical arsenal includes Problem Solving, and I'm known for my ability to mentor and elevate team performance. I'm pursuing a Senior Software Engineer position to expand my leadership impact and drive transformative change.",5,5,5,5,5.0,Excellent
160,"I'm Ritika, currently Associate Product Manager in Delhi. My professional expertise encompasses REST APIs, Machine Learning, JavaScript, and HTML/CSS. I've led the conception and deployment of ML Weather forecasting app, achieving achieved 98% accuracy in predictions. Simultaneously, I developed Restaurant management system, which received recognition and promotion. I also spearheaded Hospital management system, resulting in optimized database performance by 60%. My commitment to continuous learning has made me proficient in Web Development. I'm recognized for my ability to translate complex requirements into elegant solutions. My career objective is to become a Director of Engineering, where I can scale my impact and mentor emerging talent.",5,5,4,5,4.75,Excellent
161,"I'm Arjun, a Analytics professional based in Ahmedabad. My skillset includes Web Development, Data Analysis, Java, and Big Data. I've successfully led Recommendation engine, resulting in scaled system to handle 10x traffic, and Mobile tracking application, which received recognition and promotion. My work on Customer analytics platform delivered saved company $500K annually. I'm additionally skilled in Scala and possess a systematic approach to complex problem-solving. I'm driven to evolve into a CTO role, where I can apply my depth of experience to drive product excellence and organizational growth.",4,5,5,5,4.65,Excellent
162,"I'm Pooja, currently Quality Assurance Lead in Delhi. My professional expertise encompasses Statistics, Project Management, Leadership, and HTML/CSS. I've led the conception and deployment of Student management portal, achieving reduced processing time by 50%. Simultaneously, I developed ML classification model, which received recognition and promotion. I also spearheaded Restaurant management system, resulting in scaled system to handle 10x traffic. My commitment to continuous learning has made me proficient in Data Analysis. I'm recognized for my ability to translate complex requirements into elegant solutions. My career objective is to become a Senior Software Engineer, where I can scale my impact and mentor emerging talent.",4,5,5,4,4.5,Excellent
163,"I'm Sneha, currently MBA student in Ahmedabad. My professional expertise encompasses Java, Web Development, Statistics, and C++. I've led the conception and deployment of Real estate portal, achieving completed 2 months ahead of schedule. Simultaneously, I developed Scalable Blog platform, which saved company $500K annually. I also spearheaded Hospital management system, resulting in handled 100,000 daily active users. My commitment to continuous learning has made me proficient in Machine Learning. I'm recognized for my ability to translate complex requirements into elegant solutions. My career objective is to become a Tech Lead, where I can scale my impact and mentor emerging talent.",5,4,4,5,4.5,Excellent
164,"Hi, I'm Divya, a Senior QA Engineer from Delhi. I excel in Communication, React, and Communication Skills. My portfolio includes three standout projects: Real estate portal, where I reduced processing time by 50%, Web scraping tool which mentored 5+ junior developers, and ML Weather forecasting app, delivering saved company $500K annually. These experiences have solidified my expertise in Problem Solving and Big Data. I'm passionate about collaborative problem-solving and have consistently delivered results that exceed expectations. My vision for the future is to work as a Director of Engineering, where I can drive innovation at scale and shape industry standards.",5,5,5,5,5.0,Excellent
165,"I'm Nisha, currently Software Developer with 3 years experience in Bangalore. My professional expertise encompasses Java, Excel, Communication, and Node.js. I've led the conception and deployment of Recommendation engine, achieving established industry best practices. Simultaneously, I developed Supply chain management system, which received 5-star reviews from stakeholders. I also spearheaded Customer analytics platform, resulting in handled 100,000 daily active users. My commitment to continuous learning has made me proficient in C++. I'm recognized for my ability to translate complex requirements into elegant solutions. My career objective is to become a Tech Lead, where I can scale my impact and mentor emerging talent.",5,5,4,5,4.75,Excellent
166,"I'm Gaurav, a Civil Engineering student based in Mumbai. My expertise spans Agile, Data Analysis, Big Data, and Problem Solving. I've spearheaded three major initiatives: Customer analytics platform, which increased system efficiency by 40%, Mobile tracking application, delivering grew user base to 50,000 active users, and Student management portal which scaled system to handle 10x traffic. Each project enhanced my capabilities and contributed to organizational growth. I'm skilled in C++ and possess deep knowledge of industry best practices. My strategic approach to problem-solving has consistently driven measurable outcomes. I'm actively pursuing a role as a CTO, where I can leverage my experience to build exceptional products and lead transformative initiatives.",5,5,4,5,4.75,Excellent
167,"I'm Karan, currently Masters in Business Administration in Gurugram. My professional expertise encompasses Project Management, React, C++, and Data Analysis. I've led the conception and deployment of ML classification model, achieving received 5-star reviews from stakeholders. Simultaneously, I developed Recommendation engine, which reduced processing time by 50%. I also spearheaded Supply chain management system, resulting in received recognition and promotion. My commitment to continuous learning has made me proficient in Big Data. I'm recognized for my ability to translate complex requirements into elegant solutions. My career objective is to become a Solutions Architect, where I can scale my impact and mentor emerging talent.",4,5,5,5,4.65,Excellent
168,"Hello, I'm Anjali, a B.Tech in Civil Engineering from Kolkata. My professional expertise encompasses Problem Solving, React, JavaScript, and Kubernetes. I've led the successful execution of Student management portal, delivering reduced processing time by 50%. I also architected Restaurant management system, achieving handled 100,000 daily active users, and spearheaded Real-time Chat application, which resulted in increased system efficiency by 40%. Beyond technical skills, I'm proficient in HTML/CSS and skilled at building high-performing teams. My next career milestone is a role as a Director of Engineering, where I can drive strategic initiatives and create sustainable value.",5,5,4,4,4.6,Excellent
169,"I'm Harsh, a Fresh graduate from top institute based in Gurugram. My skillset includes SQL, Tableau, Web Development, and Data Analysis. I've successfully led Real-time Chat application, resulting in grew user base to 50,000 active users, and ML Weather forecasting app, which scaled system to handle 10x traffic. My work on IoT sensor network delivered saved company $500K annually. I'm additionally skilled in Agile and possess a systematic approach to complex problem-solving. I'm driven to evolve into a Engineering Manager role, where I can apply my depth of experience to drive product excellence and organizational growth.",4,5,5,5,4.65,Excellent
170,"I'm Isha, a Data Analyst with 2+ years experience based in Pune. My expertise spans Excel, Problem Solving, JavaScript, and HTML/CSS. I've spearheaded three major initiatives: Mobile tracking application, which handled 100,000 daily active users, Student management portal, delivering received recognition and promotion, and ML classification model which grew user base to 50,000 active users. Each project enhanced my capabilities and contributed to organizational growth. I'm skilled in C++ and possess deep knowledge of industry best practices. My strategic approach to problem-solving has consistently driven measurable outcomes. I'm actively pursuing a role as a CTO, where I can leverage my experience to build exceptional products and lead transformative initiatives.",5,5,5,4,4.85,Excellent
171,"Hello, I'm Ankit, a B.Tech in Computer Science from Gurugram. My professional expertise encompasses Agile, JavaScript, React, and Python. I've led the successful execution of Customer analytics platform, delivering mentored 5+ junior developers. I also architected Expense management system, achieving achieved 98% accuracy in predictions, and spearheaded Scalable Blog platform, which resulted in handled 100,000 daily active users. Beyond technical skills, I'm proficient in Kubernetes and skilled at building high-performing teams. My next career milestone is a role as a VP Engineering, where I can drive strategic initiatives and create sustainable value.",5,5,4,4,4.6,Excellent
