id,answer,content_score,relevance_score,vocabulary_score,structure_score,overall_score,label
71,"Hello, I'm Akshay, a Electronics Engineering student with a track record of excellence in Delhi. I've built strong proficiency in C++, Tableau, and Machine Learning. Over my career, I've successfully completed Expense management system which grew user base to 50,000 active users, Task management tool resulting in optimized database performance by 60%, and Scalable Blog platform which received recognition and promotion. My work has consistently demonstrated value, earning recognition from stakeholders. I'm competent in Project Management and Node.js, with a systematic approach to technical challenges. I'm enthusiastic about transitioning into a CTO role, where I can apply my technical depth and leadership skills to drive strategic initiatives.",4,5,5,5,4.65,Excellent
72,"My name is Aditya, and I'm a Business Analyst with consulting experience from Mumbai. With a comprehensive skill set including Problem Solving, Git, and Statistics, I've successfully delivered transformative solutions. I led the development of Expense management system, which achieved 98% accuracy in predictions. In parallel, I architected Task management tool which received recognition and promotion. My contributions to Data visualization dashboard resulted in reduced processing time by 50%, significantly impacting our organization. Beyond technical expertise, I've mentored junior developers and established best practices across teams. I'm proficient in Web Development and TensorFlow, ensuring robust and scalable solutions. My strategic vision aligns with becoming a Principal Engineer, where I can drive innovation and create lasting impact.",5,5,4,5,4.75,Excellent
73,"Hello, I'm Manvi, a Mechanical Engineering student with a track record of excellence in Delhi. I've built strong proficiency in AWS, Big Data, and JavaScript. Over my career, I've successfully completed Student management portal which grew user base to 50,000 active users, Enterprise E-commerce platform resulting in received recognition and promotion, and Real-time Chat application which established industry best practices. My work has consistently demonstrated value, earning recognition from stakeholders. I'm competent in Web Development and Tableau, with a systematic approach to technical challenges. I'm enthusiastic about transitioning into a Director of Engineering role, where I can apply my technical depth and leadership skills to drive strategic initiatives.",5,5,5,5,5.0,Excellent
74,"Hi, I'm Nisha, a Electronics Engineering student from Ahmedabad. I excel in Machine Learning, Statistics, and Communication. My portfolio includes three standout projects: Real-time Chat application, where I improved user experience significantly with 98% satisfaction, Inventory management system which optimized database performance by 60%, and ML Weather forecasting app, delivering completed 2 months ahead of schedule. These experiences have solidified my expertise in Project Management and Java. I'm passionate about collaborative problem-solving and have consistently delivered results that exceed expectations. My vision for the future is to work as a Engineering Manager, where I can drive innovation at scale and shape industry standards.",4,5,5,4,4.5,Excellent
75,"I'm Amit, a Senior Backend Developer based in Bangalore. My expertise spans Scala, Git, HTML/CSS, and Agile. I've spearheaded three major initiatives: Real estate portal, which increased system efficiency by 40%, Real-time Chat application, delivering established industry best practices, and ML classification model which improved user experience significantly with 98% satisfaction. Each project enhanced my capabilities and contributed to organizational growth. I'm skilled in React and possess deep knowledge of industry best practices. My strategic approach to problem-solving has consistently driven measurable outcomes. I'm actively pursuing a role as a Director of Engineering, where I can leverage my experience to build exceptional products and lead transformative initiatives.",4,5,5,5,4.65,Excellent
76,"I'm Nisha, a seasoned Fresh graduate from top institute based in Mumbai. I have comprehensive expertise in Problem Solving, REST APIs, SQL, and Kubernetes. I've successfully delivered Expense management system, achieving grew user base to 50,000 active users, and Student management portal, which implemented enterprise-grade security standards. My contribution to Supply chain management system resulted in received 5-star reviews from stakeholders. My technical arsenal includes Docker, and I'm known for my ability to mentor and elevate team performance. I'm pursuing a CTO position to expand my leadership impact and drive transformative change.",4,5,5,4,4.5,Excellent
77,"I'm Harsh, a seasoned Fresh graduate from top institute based in Mumbai. I have comprehensive expertise in Project Management, Big Data, Scala, and Web Development. I've successfully delivered IoT sensor network, achieving handled 100,000 daily active users, and Data visualization dashboard, which received 5-star reviews from stakeholders. My contribution to Supply chain management system resulted in implemented enterprise-grade security standards. My technical arsenal includes Problem Solving, and I'm known for my ability to mentor and elevate team performance. I'm pursuing a VP Engineering position to expand my leadership impact and drive transformative change.",4,5,5,5,4.65,Excellent
78,"My name is Akshay, and I'm a Senior QA Engineer from Bangalore. With a comprehensive skill set including Project Management, Big Data, and Communication, I've successfully delivered transformative solutions. I led the development of ML classification model, which reduced processing time by 50%. In parallel, I architected ML Weather forecasting app which mentored 5+ junior developers. My contributions to Real estate portal resulted in achieved 98% accuracy in predictions, significantly impacting our organization. Beyond technical expertise, I've mentored junior developers and established best practices across teams. I'm proficient in SQL and REST APIs, ensuring robust and scalable solutions. My strategic vision aligns with becoming a Principal Engineer, where I can drive innovation and create lasting impact.",5,5,5,4,4.85,Excellent
79,"I'm Harsh, a Full Stack Developer based in Kolkata. My expertise spans C++, Web Development, Scala, and Git. I've spearheaded three major initiatives: Inventory management system, which received 5-star reviews from stakeholders, Music streaming platform, delivering completed 2 months ahead of schedule, and IoT sensor network which mentored 5+ junior developers. Each project enhanced my capabilities and contributed to organizational growth. I'm skilled in Communication Skills and possess deep knowledge of industry best practices. My strategic approach to problem-solving has consistently driven measurable outcomes. I'm actively pursuing a role as a Senior Software Engineer, where I can leverage my experience to build exceptional products and lead transformative initiatives.",5,5,5,5,5.0,Excellent
80,"I'm Varun, a seasoned Masters in Business Administration based in Hyderabad. I have comprehensive expertise in C++, Machine Learning, Scala, and REST APIs. I've successfully delivered Music streaming platform, achieving received 5-star reviews from stakeholders, and Student management portal, which reduced processing time by 50%. My contribution to Task management tool resulted in handled 100,000 daily active users. My technical arsenal includes Data Analysis, and I'm known for my ability to mentor and elevate team performance. I'm pursuing a Principal Engineer position to expand my leadership impact and drive transformative change.",4,5,5,5,4.65,Excellent
81,"I'm Rohan, a seasoned Senior Data Analyst based in Delhi. I have comprehensive expertise in Tableau, Docker, Python, and Scala. I've successfully delivered Data visualization dashboard, achieving reduced processing time by 50%, and ML classification model, which established industry best practices. My contribution to Mobile tracking application resulted in handled 100,000 daily active users. My technical arsenal includes Agile, and I'm known for my ability to mentor and elevate team performance. I'm pursuing a Director of Engineering position to expand my leadership impact and drive transformative change.",4,5,5,5,4.65,Excellent
82,"I'm Sanjay, a seasoned Electronics Engineering student based in Delhi. I have comprehensive expertise in AWS, React, TensorFlow, and SQL. I've successfully delivered Mobile tracking application, achieving achieved 98% accuracy in predictions, and Customer analytics platform, which mentored 5+ junior developers. My contribution to Real-time Chat application resulted in optimized database performance by 60%. My technical arsenal includes Big Data, and I'm known for my ability to mentor and elevate team performance. I'm pursuing a Tech Lead position to expand my leadership impact and drive transformative change.",5,5,5,4,4.85,Excellent
83,"I'm Isha, a B.Tech in Mechanical Engineering based in Gurugram. My expertise spans Statistics, TensorFlow, Tableau, and Python. I've spearheaded three major initiatives: Real-time Chat application, which optimized database performance by 60%, Data visualization dashboard, delivering saved company $500K annually, and ML classification model which mentored 5+ junior developers. Each project enhanced my capabilities and contributed to organizational growth. I'm skilled in Java and possess deep knowledge of industry best practices. My strategic approach to problem-solving has consistently driven measurable outcomes. I'm actively pursuing a role as a VP Engineering, where I can leverage my experience to build exceptional products and lead transformative initiatives.",5,4,5,5,4.75,Excellent
84,"My name is Priya, and I'm a Business Analyst with consulting experience from Chennai. With a comprehensive skill set including Big Data, HTML/CSS, and Excel, I've successfully delivered transformative solutions. I led the development of Music streaming platform, which implemented enterprise-grade security standards. In parallel, I architected Customer analytics platform which reduced processing time by 50%. My contributions to Enterprise E-commerce platform resulted in established industry best practices, significantly impacting our organization. Beyond technical expertise, I've mentored junior developers and established best practices across teams. I'm proficient in Docker and Node.js, ensuring robust and scalable solutions. My strategic vision aligns with becoming a Engineering Manager, where I can drive innovation and create lasting impact.",4,5,5,4,4.5,Excellent
85,"My name is Amit. I'm a CS major from Pune with deep expertise in Project Management, Kubernetes, and Big Data. My career highlights include leading Student management portal which mentored 5+ junior developers, architecting Task management tool that achieved 98% accuracy in predictions, and spearheading ML Weather forecasting app which received recognition and promotion. I bring additional competency in Statistics and Problem Solving, ensuring comprehensive technical excellence. My approach combines technical rigor with strategic thinking. I'm committed to becoming a CTO, where I can leverage my comprehensive skill set to drive organizational excellence and innovation.",5,4,4,5,4.5,Excellent
86,"Hi, I'm Priya, a B.Tech in Electronics and Communication from Hyderabad. I excel in Project Management, REST APIs, and Communication. My portfolio includes three standout projects: Supply chain management system, where I achieved 98% accuracy in predictions, Web scraping tool which received recognition and promotion, and ML classification model, delivering completed 2 months ahead of schedule. These experiences have solidified my expertise in Java and Leadership. I'm passionate about collaborative problem-solving and have consistently delivered results that exceed expectations. My vision for the future is to work as a Principal Engineer, where I can drive innovation at scale and shape industry standards.",5,5,4,5,4.75,Excellent
87,"Hello, I'm Sanjay, a B.Tech in Electronics and Communication from Gurugram. I have a strong foundation in Communication Skills, Machine Learning, and Data Analysis. Throughout my career, I've successfully led multiple impactful projects. My flagship project Student management portal increased system efficiency by 40% and currently serves thousands of users. Additionally, I developed Scalable Blog platform which handled 100,000 daily active users. I've also contributed to ML Weather forecasting app where I implemented enterprise-grade security standards. My technical expertise extends to Android Development and Communication. I'm passionate about Director of Engineering and continuously seek opportunities to innovate and lead high-performing teams. I'm excited to bring my experience and vision to your organization.",4,5,5,5,4.65,Excellent
88,"My name is Ravi. I'm a Full Stack Developer from Pune with deep expertise in React, Problem Solving, and Leadership. My career highlights include leading Task management tool which received recognition and promotion, architecting Scalable Blog platform that completed 2 months ahead of schedule, and spearheading Real-time Chat application which saved company $500K annually. I bring additional competency in Project Management and Excel, ensuring comprehensive technical excellence. My approach combines technical rigor with strategic thinking. I'm committed to becoming a Principal Engineer, where I can leverage my comprehensive skill set to drive organizational excellence and innovation.",5,5,5,4,4.85,Excellent
89,"My name is Isha. I'm a B.Tech in Computer Science from Mumbai with deep expertise in React, REST APIs, and AWS. My career highlights include leading Real estate portal which handled 100,000 daily active users, architecting Customer analytics platform that implemented enterprise-grade security standards, and spearheading Scalable Blog platform which reduced processing time by 50%. I bring additional competency in Git and Leadership, ensuring comprehensive technical excellence. My approach combines technical rigor with strategic thinking. I'm committed to becoming a VP Engineering, where I can leverage my comprehensive skill set to drive organizational excellence and innovation.",5,5,5,4,4.85,Excellent
90,"I'm Vipul, currently Masters in Business Administration in Kolkata. My professional expertise encompasses HTML/CSS, C++, Statistics, and Java. I've led the conception and deployment of Real-time Chat application, achieving implemented enterprise-grade security standards. Simultaneously, I developed Real estate portal, which achieved 98% accuracy in predictions. I also spearheaded Supply chain management system, resulting in increased system efficiency by 40%. My commitment to continuous learning has made me proficient in AWS. I'm recognized for my ability to translate complex requirements into elegant solutions. My career objective is to become a VP Engineering, where I can scale my impact and mentor emerging talent.",5,5,5,4,4.85,Excellent
91,"I'm Nisha, currently Masters in Business Administration in Gurugram. My professional expertise encompasses Android Development, Docker, Data Analysis, and Statistics. I've led the conception and deployment of Recommendation engine, achieving completed 2 months ahead of schedule. Simultaneously, I developed Customer analytics platform, which achieved 98% accuracy in predictions. I also spearheaded ML classification model, resulting in increased system efficiency by 40%. My commitment to continuous learning has made me proficient in Machine Learning. I'm recognized for my ability to translate complex requirements into elegant solutions. My career objective is to become a Tech Lead, where I can scale my impact and mentor emerging talent.",5,4,5,5,4.75,Excellent
92,"Hi, I'm Vipul, a CS major from Gurugram. I excel in Machine Learning, Project Management, and SQL. My portfolio includes three standout projects: Hospital management system, where I received 5-star reviews from stakeholders, Supply chain management system which established industry best practices, and Customer analytics platform, delivering implemented enterprise-grade security standards. These experiences have solidified my expertise in Big Data and HTML/CSS. I'm passionate about collaborative problem-solving and have consistently delivered results that exceed expectations. My vision for the future is to work as a Machine Learning Lead, where I can drive innovation at scale and shape industry standards.",5,4,4,5,4.5,Excellent
93,"I'm Isha, a Mechanical Engineering student based in Pune. My skillset includes Machine Learning, Tableau, Agile, and Node.js. I've successfully led Data visualization dashboard, resulting in grew user base to 50,000 active users, and Web scraping tool, which implemented enterprise-grade security standards. My work on Student management portal delivered mentored 5+ junior developers. I'm additionally skilled in REST APIs and possess a systematic approach to complex problem-solving. I'm driven to evolve into a VP Engineering role, where I can apply my depth of experience to drive product excellence and organizational growth.",5,5,5,4,4.85,Excellent
94,"I'm Aditya, a seasoned Fresh graduate from top institute based in Kolkata. I have comprehensive expertise in Leadership, Project Management, Scala, and Java. I've successfully delivered Supply chain management system, achieving implemented enterprise-grade security standards, and ML Weather forecasting app, which reduced processing time by 50%. My contribution to IoT sensor network resulted in received recognition and promotion. My technical arsenal includes Git, and I'm known for my ability to mentor and elevate team performance. I'm pursuing a Director of Engineering position to expand my leadership impact and drive transformative change.",5,5,4,4,4.6,Excellent
95,"My name is Isha, and I'm a Mechanical Engineering student from Ahmedabad. With a comprehensive skill set including SQL, REST APIs, and HTML/CSS, I've successfully delivered transformative solutions. I led the development of Real-time Chat application, which improved user experience significantly with 98% satisfaction. In parallel, I architected Recommendation engine which completed 2 months ahead of schedule. My contributions to Hospital management system resulted in received recognition and promotion, significantly impacting our organization. Beyond technical expertise, I've mentored junior developers and established best practices across teams. I'm proficient in AWS and Agile, ensuring robust and scalable solutions. My strategic vision aligns with becoming a Solutions Architect, where I can drive innovation and create lasting impact.",5,5,5,5,5.0,Excellent
96,"Hello, I'm Neha, a Senior QA Engineer with a track record of excellence in Hyderabad. I've built strong proficiency in Data Analysis, Java, and HTML/CSS. Over my career, I've successfully completed Expense management system which achieved 98% accuracy in predictions, Scalable Blog platform resulting in received 5-star reviews from stakeholders, and ML Weather forecasting app which increased system efficiency by 40%. My work has consistently demonstrated value, earning recognition from stakeholders. I'm competent in Agile and Python, with a systematic approach to technical challenges. I'm enthusiastic about transitioning into a VP Engineering role, where I can apply my technical depth and leadership skills to drive strategic initiatives.",5,4,5,5,4.75,Excellent
97,"I'm Harsh, a Full Stack Developer based in Delhi. My expertise spans Communication, Web Development, Scala, and Tableau. I've spearheaded three major initiatives: Real estate portal, which improved user experience significantly with 98% satisfaction, Real-time Chat application, delivering increased system efficiency by 40%, and Expense management system which implemented enterprise-grade security standards. Each project enhanced my capabilities and contributed to organizational growth. I'm skilled in JavaScript and possess deep knowledge of industry best practices. My strategic approach to problem-solving has consistently driven measurable outcomes. I'm actively pursuing a role as a Principal Engineer, where I can leverage my experience to build exceptional products and lead transformative initiatives.",4,5,5,4,4.5,Excellent
98,"My name is Sneha. I'm a Senior QA Engineer from Delhi with deep expertise in Web Development, C++, and HTML/CSS. My career highlights include leading IoT sensor network which implemented enterprise-grade security standards, architecting Recommendation engine that mentored 5+ junior developers, and spearheading Customer analytics platform which improved user experience significantly with 98% satisfaction. I bring additional competency in Data Analysis and Python, ensuring comprehensive technical excellence. My approach combines technical rigor with strategic thinking. I'm committed to becoming a Director of Engineering, where I can leverage my comprehensive skill set to drive organizational excellence and innovation.",5,4,4,5,4.5,Excellent
99,"I'm Shreya, currently Senior Business Analyst in Bangalore. My professional expertise encompasses Project Management, Communication Skills, Web Development, and JavaScript. I've led the conception and deployment of Mobile tracking application, achieving achieved 98% accuracy in predictions. Simultaneously, I developed Hospital management system, which completed 2 months ahead of schedule. I also spearheaded Music streaming platform, resulting in received 5-star reviews from stakeholders. My commitment to continuous learning has made me proficient in Docker. I'm recognized for my ability to translate complex requirements into elegant solutions. My career objective is to become a Machine Learning Lead, where I can scale my impact and mentor emerging talent.",5,4,4,5,4.5,Excellent
100,"My name is Sneha, and I'm a Senior Data Analyst from Gurugram. With a comprehensive skill set including Statistics, AWS, and Node.js, I've successfully delivered transformative solutions. I led the development of Customer analytics platform, which received 5-star reviews from stakeholders. In parallel, I architected Real-time Chat application which increased system efficiency by 40%. My contributions to Expense management system resulted in reduced processing time by 50%, significantly impacting our organization. Beyond technical expertise, I've mentored junior developers and established best practices across teams. I'm proficient in Communication Skills and Project Management, ensuring robust and scalable solutions. My strategic vision aligns with becoming a Solutions Architect, where I can drive innovation and create lasting impact.",5,5,5,4,4.85,Excellent
101,"Hello, I'm Vipul, a Business Analyst with consulting experience from Chennai. My professional expertise encompasses TensorFlow, Tableau, Project Management, and Big Data. I've led the successful execution of Customer analytics platform, delivering saved company $500K annually. I also architected Web scraping tool, achieving completed 2 months ahead of schedule, and spearheaded Restaurant management system, which resulted in improved user experience significantly with 98% satisfaction. Beyond technical skills, I'm proficient in Web Development and skilled at building high-performing teams. My next career milestone is a role as a Director of Engineering, where I can drive strategic initiatives and create sustainable value.",4,5,5,4,4.5,Excellent
102,"Hello, I'm Nisha, a Electronics Engineering student from Kolkata. My professional expertise encompasses Project Management, Leadership, Data Analysis, and Problem Solving. I've led the successful execution of Inventory management system, delivering increased system efficiency by 40%. I also architected Enterprise E-commerce platform, achieving handled 100,000 daily active users, and spearheaded ML classification model, which resulted in improved user experience significantly with 98% satisfaction. Beyond technical skills, I'm proficient in Node.js and skilled at building high-performing teams. My next career milestone is a role as a Solutions Architect, where I can drive strategic initiatives and create sustainable value.",5,5,4,5,4.75,Excellent
103,"I'm Arjun, a Fresh graduate from top institute based in Bangalore. My expertise spans C++, AWS, Big Data, and Node.js. I've spearheaded three major initiatives: Recommendation engine, which handled 100,000 daily active users, IoT sensor network, delivering achieved 98% accuracy in predictions, and Web scraping tool which implemented enterprise-grade security standards. Each project enhanced my capabilities and contributed to organizational growth. I'm skilled in Tableau and possess deep knowledge of industry best practices. My strategic approach to problem-solving has consistently driven measurable outcomes. I'm actively pursuing a role as a Principal Engineer, where I can leverage my experience to build exceptional products and lead transformative initiatives.",5,5,5,5,5.0,Excellent
