id,answer,content_score,relevance_score,vocabulary_score,structure_score,overall_score,label
1,"I'm Arjun, currently Data Analyst with 2+ years experience in Delhi. My professional expertise encompasses Statistics, Node.js, Scala, and Java. I've led the conception and deployment of Task management tool, achieving received 5-star reviews from stakeholders. Simultaneously, I developed Restaurant management system, which grew user base to 50,000 active users. I also spearheaded Expense management system, resulting in achieved 98% accuracy in predictions. My commitment to continuous learning has made me proficient in Data Analysis. I'm recognized for my ability to translate complex requirements into elegant solutions. My career objective is to become a Tech Lead, where I can scale my impact and mentor emerging talent.",5,5,4,5,4.75,Excellent
2,"My name is Vikram. I'm a Product Manager from Delhi with deep expertise in Communication Skills, Problem Solving, and JavaScript. My career highlights include leading Real-time Chat application which mentored 5+ junior developers, architecting Task management tool that increased system efficiency by 40%, and spearheading Customer analytics platform which handled 100,000 daily active users. I bring additional competency in Big Data and Java, ensuring comprehensive technical excellence. My approach combines technical rigor with strategic thinking. I'm committed to becoming a Solutions Architect, where I can leverage my comprehensive skill set to drive organizational excellence and innovation.",5,5,4,5,4.75,Excellent
3,"Hi, I'm Aisha, a Masters in Business Administration from Ahmedabad. I excel in TensorFlow, Docker, and HTML/CSS. My portfolio includes three standout projects: Restaurant management system, where I received recognition and promotion, Enterprise E-commerce platform which mentored 5+ junior developers, and IoT sensor network, delivering saved company $500K annually. These experiences have solidified my expertise in Tableau and Git. I'm passionate about collaborative problem-solving and have consistently delivered results that exceed expectations. My vision for the future is to work as a VP Engineering, where I can drive innovation at scale and shape industry standards.",5,5,5,4,4.85,Excellent
4,"My name is Megha. I'm a Quality Assurance Lead from Gurugram with deep expertise in Scala, Leadership, and HTML/CSS. My career highlights include leading Real-time Chat application which reduced processing time by 50%, architecting Web scraping tool that received 5-star reviews from stakeholders, and spearheading Real estate portal which established industry best practices. I bring additional competency in Data Analysis and Communication Skills, ensuring comprehensive technical excellence. My approach combines technical rigor with strategic thinking. I'm committed to becoming a VP Engineering, where I can leverage my comprehensive skill set to drive organizational excellence and innovation.",5,4,4,5,4.5,Excellent
5,"I'm Nisha, a Analytics professional based in Delhi. My skillset includes Git, C++, TensorFlow, and HTML/CSS. I've successfully led Enterprise E-commerce platform, resulting in completed 2 months ahead of schedule, and Hospital management system, which implemented enterprise-grade security standards. My work on Data visualization dashboard delivered established industry best practices. I'm additionally skilled in AWS and possess a systematic approach to complex problem-solving. I'm driven to evolve into a Senior Software Engineer role, where I can apply my depth of experience to drive product excellence and organizational growth.",5,4,4,5,4.5,Excellent
6,"Hello, I'm Varun, a Fresh graduate from top institute with a track record of excellence in Ahmedabad. I've built strong proficiency in SQL, Statistics, and Problem Solving. Over my career, I've successfully completed ML classification model which reduced processing time by 50%, Inventory management system resulting in optimized database performance by 60%, and Enterprise E-commerce platform which achieved 98% accuracy in predictions. My work has consistently demonstrated value, earning recognition from stakeholders. I'm competent in Excel and Leadership, with a systematic approach to technical challenges. I'm enthusiastic about transitioning into a Senior Software Engineer role, where I can apply my technical depth and leadership skills to drive strategic initiatives.",5,4,4,5,4.5,Excellent
7,"My name is Rahul. I'm a Data Analyst with 2+ years experience from Mumbai with deep expertise in C++, Tableau, and AWS. My career highlights include leading Enterprise E-commerce platform which improved user experience significantly with 98% satisfaction, architecting Expense management system that implemented enterprise-grade security standards, and spearheading IoT sensor network which grew user base to 50,000 active users. I bring additional competency in Agile and Communication, ensuring comprehensive technical excellence. My approach combines technical rigor with strategic thinking. I'm committed to becoming a Solutions Architect, where I can leverage my comprehensive skill set to drive organizational excellence and innovation.",5,5,5,5,5.0,Excellent
8,"Hello, I'm Nisha, a Senior Business Analyst from Kolkata. I have a strong foundation in Python, HTML/CSS, and Data Analysis. Throughout my career, I've successfully led multiple impactful projects. My flagship project Real-time Chat application saved company $500K annually and currently serves thousands of users. Additionally, I developed Task management tool which achieved 98% accuracy in predictions. I've also contributed to Hospital management system where I grew user base to 50,000 active users. My technical expertise extends to Big Data and Communication. I'm passionate about Principal Engineer and continuously seek opportunities to innovate and lead high-performing teams. I'm excited to bring my experience and vision to your organization.",5,5,5,5,5.0,Excellent
9,"I'm Divya, currently Quality Assurance Lead in Chennai. My professional expertise encompasses AWS, SQL, Statistics, and Node.js. I've led the conception and deployment of ML Weather forecasting app, achieving completed 2 months ahead of schedule. Simultaneously, I developed Scalable Blog platform, which increased system efficiency by 40%. I also spearheaded IoT sensor network, resulting in grew user base to 50,000 active users. My commitment to continuous learning has made me proficient in Tableau. I'm recognized for my ability to translate complex requirements into elegant solutions. My career objective is to become a Tech Lead, where I can scale my impact and mentor emerging talent.",4,5,5,4,4.5,Excellent
10,"I'm Anjali, a seasoned Senior Business Analyst based in Kolkata. I have comprehensive expertise in Data Analysis, Tableau, Node.js, and Scala. I've successfully delivered Task management tool, achieving improved user experience significantly with 98% satisfaction, and Restaurant management system, which implemented enterprise-grade security standards. My contribution to Music streaming platform resulted in grew user base to 50,000 active users. My technical arsenal includes Statistics, and I'm known for my ability to mentor and elevate team performance. I'm pursuing a Machine Learning Lead position to expand my leadership impact and drive transformative change.",5,5,4,4,4.6,Excellent
11,"I'm Aryan, currently Mechanical Engineering student in Hyderabad. My professional expertise encompasses Big Data, Node.js, Android Development, and Excel. I've led the conception and deployment of Music streaming platform, achieving implemented enterprise-grade security standards. Simultaneously, I developed Real-time Chat application, which achieved 98% accuracy in predictions. I also spearheaded Recommendation engine, resulting in mentored 5+ junior developers. My commitment to continuous learning has made me proficient in Java. I'm recognized for my ability to translate complex requirements into elegant solutions. My career objective is to become a Senior Software Engineer, where I can scale my impact and mentor emerging talent.",5,5,4,4,4.6,Excellent
12,"I'm Harsh, a B.Tech in Mechanical Engineering based in Mumbai. My skillset includes Statistics, SQL, Big Data, and Kubernetes. I've successfully led Web scraping tool, resulting in handled 100,000 daily active users, and IoT sensor network, which grew user base to 50,000 active users. My work on Enterprise E-commerce platform delivered scaled system to handle 10x traffic. I'm additionally skilled in Project Management and possess a systematic approach to complex problem-solving. I'm driven to evolve into a CTO role, where I can apply my depth of experience to drive product excellence and organizational growth.",4,5,5,5,4.65,Excellent
13,"I'm Rahul, a Quality Assurance Lead based in Ahmedabad. My expertise spans Agile, Git, JavaScript, and Java. I've spearheaded three major initiatives: ML classification model, which received 5-star reviews from stakeholders, Hospital management system, delivering received recognition and promotion, and Mobile tracking application which achieved 98% accuracy in predictions. Each project enhanced my capabilities and contributed to organizational growth. I'm skilled in AWS and possess deep knowledge of industry best practices. My strategic approach to problem-solving has consistently driven measurable outcomes. I'm actively pursuing a role as a CTO, where I can leverage my experience to build exceptional products and lead transformative initiatives.",4,5,5,5,4.65,Excellent
14,"My name is Neha. I'm a B.Tech in Civil Engineering from Kolkata with deep expertise in Tableau, Android Development, and TensorFlow. My career highlights include leading Expense management system which improved user experience significantly with 98% satisfaction, architecting IoT sensor network that handled 100,000 daily active users, and spearheading Hospital management system which received recognition and promotion. I bring additional competency in Data Analysis and Scala, ensuring comprehensive technical excellence. My approach combines technical rigor with strategic thinking. I'm committed to becoming a Director of Engineering, where I can leverage my comprehensive skill set to drive organizational excellence and innovation.",4,5,5,5,4.65,Excellent
15,"I'm Gaurav, a Computer Science student based in Chennai. My skillset includes Problem Solving, Git, Leadership, and Agile. I've successfully led Data visualization dashboard, resulting in established industry best practices, and ML classification model, which optimized database performance by 60%. My work on Real estate portal delivered scaled system to handle 10x traffic. I'm additionally skilled in Node.js and possess a systematic approach to complex problem-solving. I'm driven to evolve into a Machine Learning Lead role, where I can apply my depth of experience to drive product excellence and organizational growth.",4,5,5,4,4.5,Excellent
16,"I'm Ritika, a Senior QA Engineer based in Pune. My skillset includes Data Analysis, JavaScript, Python, and Communication. I've successfully led Web scraping tool, resulting in implemented enterprise-grade security standards, and Task management tool, which increased system efficiency by 40%. My work on Supply chain management system delivered optimized database performance by 60%. I'm additionally skilled in REST APIs and possess a systematic approach to complex problem-solving. I'm driven to evolve into a VP Engineering role, where I can apply my depth of experience to drive product excellence and organizational growth.",5,4,4,5,4.5,Excellent
17,"I'm Ankit, a B.Tech in Electronics and Communication based in Ahmedabad. My skillset includes Big Data, Docker, Leadership, and React. I've successfully led Customer analytics platform, resulting in grew user base to 50,000 active users, and Enterprise E-commerce platform, which completed 2 months ahead of schedule. My work on Restaurant management system delivered achieved 98% accuracy in predictions. I'm additionally skilled in Agile and possess a systematic approach to complex problem-solving. I'm driven to evolve into a Principal Engineer role, where I can apply my depth of experience to drive product excellence and organizational growth.",5,5,4,4,4.6,Excellent
18,"My name is Ankit. I'm a Full Stack Developer from Delhi with deep expertise in REST APIs, Data Analysis, and Machine Learning. My career highlights include leading Music streaming platform which established industry best practices, architecting Scalable Blog platform that achieved 98% accuracy in predictions, and spearheading Supply chain management system which handled 100,000 daily active users. I bring additional competency in Java and Android Development, ensuring comprehensive technical excellence. My approach combines technical rigor with strategic thinking. I'm committed to becoming a CTO, where I can leverage my comprehensive skill set to drive organizational excellence and innovation.",4,5,5,4,4.5,Excellent
19,"I'm Varun, a seasoned B.Tech in Mechanical Engineering based in Gurugram. I have comprehensive expertise in Kubernetes, Machine Learning, Tableau, and C++. I've successfully delivered IoT sensor network, achieving improved user experience significantly with 98% satisfaction, and Mobile tracking application, which increased system efficiency by 40%. My contribution to ML classification model resulted in scaled system to handle 10x traffic. My technical arsenal includes HTML/CSS, and I'm known for my ability to mentor and elevate team performance. I'm pursuing a Solutions Architect position to expand my leadership impact and drive transformative change.",5,5,4,5,4.75,Excellent
20,"I'm Nikhil, a Senior Business Analyst based in Hyderabad. My expertise spans Java, Web Development, Machine Learning, and C++. I've spearheaded three major initiatives: Enterprise E-commerce platform, which saved company $500K annually, Supply chain management system, delivering received 5-star reviews from stakeholders, and Mobile tracking application which implemented enterprise-grade security standards. Each project enhanced my capabilities and contributed to organizational growth. I'm skilled in Excel and possess deep knowledge of industry best practices. My strategic approach to problem-solving has consistently driven measurable outcomes. I'm actively pursuing a role as a Senior Software Engineer, where I can leverage my experience to build exceptional products and lead transformative initiatives.",5,4,5,5,4.75,Excellent
21,"I'm Isha, currently Senior Data Analyst in Chennai. My professional expertise encompasses React, REST APIs, HTML/CSS, and TensorFlow. I've led the conception and deployment of Recommendation engine, achieving grew user base to 50,000 active users. Simultaneously, I developed Music streaming platform, which received 5-star reviews from stakeholders. I also spearheaded Enterprise E-commerce platform, resulting in mentored 5+ junior developers. My commitment to continuous learning has made me proficient in Node.js. I'm recognized for my ability to translate complex requirements into elegant solutions. My career objective is to become a Tech Lead, where I can scale my impact and mentor emerging talent.",4,5,5,5,4.65,Excellent
22,"My name is Swati. I'm a Senior QA Engineer from Gurugram with deep expertise in Excel, C++, and Big Data. My career highlights include leading Inventory management system which optimized database performance by 60%, architecting Student management portal that grew user base to 50,000 active users, and spearheading Task management tool which established industry best practices. I bring additional competency in Project Management and Scala, ensuring comprehensive technical excellence. My approach combines technical rigor with strategic thinking. I'm committed to becoming a Principal Engineer, where I can leverage my comprehensive skill set to drive organizational excellence and innovation.",4,5,5,5,4.65,Excellent
23,"I'm Priya, a Senior QA Engineer based in Ahmedabad. My skillset includes AWS, React, Machine Learning, and Excel. I've successfully led ML Weather forecasting app, resulting in scaled system to handle 10x traffic, and Music streaming platform, which saved company $500K annually. My work on Supply chain management system delivered received 5-star reviews from stakeholders. I'm additionally skilled in Java and possess a systematic approach to complex problem-solving. I'm driven to evolve into a Principal Engineer role, where I can apply my depth of experience to drive product excellence and organizational growth.",5,5,4,4,4.6,Excellent
24,"I'm Siddharth, a Data Analyst with 2+ years experience based in Bangalore. My expertise spans Data Analysis, Kubernetes, C++, and Node.js. I've spearheaded three major initiatives: ML Weather forecasting app, which optimized database performance by 60%, Task management tool, delivering completed 2 months ahead of schedule, and Data visualization dashboard which achieved 98% accuracy in predictions. Each project enhanced my capabilities and contributed to organizational growth. I'm skilled in Java and possess deep knowledge of industry best practices. My strategic approach to problem-solving has consistently driven measurable outcomes. I'm actively pursuing a role as a Solutions Architect, where I can leverage my experience to build exceptional products and lead transformative initiatives.",5,4,5,5,4.75,Excellent
25,"My name is Amit, and I'm a Business Analyst with consulting experience from Delhi. With a comprehensive skill set including Problem Solving, Kubernetes, and TensorFlow, I've successfully delivered transformative solutions. I led the development of Data visualization dashboard, which saved company $500K annually. In parallel, I architected Mobile tracking application which reduced processing time by 50%. My contributions to Restaurant management system resulted in improved user experience significantly with 98% satisfaction, significantly impacting our organization. Beyond technical expertise, I've mentored junior developers and established best practices across teams. I'm proficient in Machine Learning and Web Development, ensuring robust and scalable solutions. My strategic vision aligns with becoming a Senior Software Engineer, where I can drive innovation and create lasting impact.",5,5,4,5,4.75,Excellent
26,"Hello, I'm Neha, a Full Stack Developer with a track record of excellence in Delhi. I've built strong proficiency in C++, JavaScript, and Web Development. Over my career, I've successfully completed Expense management system which handled 100,000 daily active users, Enterprise E-commerce platform resulting in completed 2 months ahead of schedule, and Supply chain management system which implemented enterprise-grade security standards. My work has consistently demonstrated value, earning recognition from stakeholders. I'm competent in React and SQL, with a systematic approach to technical challenges. I'm enthusiastic about transitioning into a Machine Learning Lead role, where I can apply my technical depth and leadership skills to drive strategic initiatives.",4,5,5,4,4.5,Excellent
27,"I'm Vipul, a CS major based in Pune. My skillset includes Agile, TensorFlow, Python, and Kubernetes. I've successfully led Music streaming platform, resulting in improved user experience significantly with 98% satisfaction, and Enterprise E-commerce platform, which completed 2 months ahead of schedule. My work on Student management portal delivered grew user base to 50,000 active users. I'm additionally skilled in AWS and possess a systematic approach to complex problem-solving. I'm driven to evolve into a Tech Lead role, where I can apply my depth of experience to drive product excellence and organizational growth.",4,5,5,4,4.5,Excellent
28,"Hello, I'm Nikhil, a Product Manager from Kolkata. My professional expertise encompasses Machine Learning, Communication Skills, AWS, and Communication. I've led the successful execution of Web scraping tool, delivering implemented enterprise-grade security standards. I also architected Student management portal, achieving reduced processing time by 50%, and spearheaded Expense management system, which resulted in completed 2 months ahead of schedule. Beyond technical skills, I'm proficient in Leadership and skilled at building high-performing teams. My next career milestone is a role as a Senior Software Engineer, where I can drive strategic initiatives and create sustainable value.",5,5,4,5,4.75,Excellent
29,"Hi, I'm Isha, a B.Tech in Electronics and Communication from Mumbai. I excel in Agile, Docker, and JavaScript. My portfolio includes three standout projects: Real-time Chat application, where I received recognition and promotion, Hospital management system which handled 100,000 daily active users, and Inventory management system, delivering received 5-star reviews from stakeholders. These experiences have solidified my expertise in Android Development and Big Data. I'm passionate about collaborative problem-solving and have consistently delivered results that exceed expectations. My vision for the future is to work as a Tech Lead, where I can drive innovation at scale and shape industry standards.",5,4,5,5,4.75,Excellent
30,"Hello, I'm Pooja, a Quality Assurance Lead from Gurugram. My professional expertise encompasses Node.js, React, Kubernetes, and HTML/CSS. I've led the successful execution of Student management portal, delivering increased system efficiency by 40%. I also architected ML classification model, achieving improved user experience significantly with 98% satisfaction, and spearheaded Data visualization dashboard, which resulted in established industry best practices. Beyond technical skills, I'm proficient in Scala and skilled at building high-performing teams. My next career milestone is a role as a Principal Engineer, where I can drive strategic initiatives and create sustainable value.",5,5,5,5,5.0,Excellent
31,"I'm Amit, a Recent graduate with internship experience based in Kolkata. My expertise spans Communication, Machine Learning, Web Development, and Python. I've spearheaded three major initiatives: Mobile tracking application, which reduced processing time by 50%, Task management tool, delivering implemented enterprise-grade security standards, and Real-time Chat application which handled 100,000 daily active users. Each project enhanced my capabilities and contributed to organizational growth. I'm skilled in Kubernetes and possess deep knowledge of industry best practices. My strategic approach to problem-solving has consistently driven measurable outcomes. I'm actively pursuing a role as a Solutions Architect, where I can leverage my experience to build exceptional products and lead transformative initiatives.",5,5,4,4,4.6,Excellent
32,"My name is Priya, and I'm a MBA student from Mumbai. With a comprehensive skill set including Excel, Android Development, and Git, I've successfully delivered transformative solutions. I led the development of Expense management system, which handled 100,000 daily active users. In parallel, I architected Recommendation engine which scaled system to handle 10x traffic. My contributions to Student management portal resulted in implemented enterprise-grade security standards, significantly impacting our organization. Beyond technical expertise, I've mentored junior developers and established best practices across teams. I'm proficient in Java and HTML/CSS, ensuring robust and scalable solutions. My strategic vision aligns with becoming a Machine Learning Lead, where I can drive innovation and create lasting impact.",4,5,5,4,4.5,Excellent
33,"Hello, I'm Anjana, a MBA student with a track record of excellence in Hyderabad. I've built strong proficiency in Java, Communication, and C++. Over my career, I've successfully completed Task management tool which implemented enterprise-grade security standards, Scalable Blog platform resulting in achieved 98% accuracy in predictions, and Inventory management system which improved user experience significantly with 98% satisfaction. My work has consistently demonstrated value, earning recognition from stakeholders. I'm competent in Scala and Kubernetes, with a systematic approach to technical challenges. I'm enthusiastic about transitioning into a CTO role, where I can apply my technical depth and leadership skills to drive strategic initiatives.",5,5,5,5,5.0,Excellent
34,"Hi, I'm Vikram, a Senior QA Engineer from Hyderabad. I excel in Problem Solving, Java, and Statistics. My portfolio includes three standout projects: Enterprise E-commerce platform, where I reduced processing time by 50%, Recommendation engine which established industry best practices, and Inventory management system, delivering saved company $500K annually. These experiences have solidified my expertise in React and Agile. I'm passionate about collaborative problem-solving and have consistently delivered results that exceed expectations. My vision for the future is to work as a VP Engineering, where I can drive innovation at scale and shape industry standards.",4,5,5,4,4.5,Excellent
35,"I'm Gaurav, a seasoned Analytics professional based in Pune. I have comprehensive expertise in HTML/CSS, REST APIs, Excel, and Communication. I've successfully delivered Real-time Chat application, achieving reduced processing time by 50%, and Inventory management system, which saved company $500K annually. My contribution to Recommendation engine resulted in mentored 5+ junior developers. My technical arsenal includes JavaScript, and I'm known for my ability to mentor and elevate team performance. I'm pursuing a Tech Lead position to expand my leadership impact and drive transformative change.",5,5,5,4,4.85,Excellent
