id,answer,content_score,relevance_score,vocabulary_score,structure_score,overall_score,label
104,"I'm Neha, currently Senior Data Analyst in Mumbai. My professional expertise encompasses Web Development, Docker, Problem Solving, and Kubernetes. I've led the conception and deployment of Data visualization dashboard, achieving saved company $500K annually. Simultaneously, I developed Task management tool, which received recognition and promotion. I also spearheaded IoT sensor network, resulting in scaled system to handle 10x traffic. My commitment to continuous learning has made me proficient in Java. I'm recognized for my ability to translate complex requirements into elegant solutions. My career objective is to become a Principal Engineer, where I can scale my impact and mentor emerging talent.",5,4,5,5,4.75,Excellent
105,"Hello, I'm Nikhil, a CS major from Bangalore. I have a strong foundation in REST APIs, Statistics, and Android Development. Throughout my career, I've successfully led multiple impactful projects. My flagship project Hospital management system completed 2 months ahead of schedule and currently serves thousands of users. Additionally, I developed Customer analytics platform which scaled system to handle 10x traffic. I've also contributed to Restaurant management system where I optimized database performance by 60%. My technical expertise extends to Communication Skills and AWS. I'm passionate about Director of Engineering and continuously seek opportunities to innovate and lead high-performing teams. I'm excited to bring my experience and vision to your organization.",5,5,5,5,5.0,Excellent
106,"Hello, I'm Nikhil, a Masters in Business Administration from Chennai. I have a strong foundation in Data Analysis, Node.js, and Excel. Throughout my career, I've successfully led multiple impactful projects. My flagship project Task management tool handled 100,000 daily active users and currently serves thousands of users. Additionally, I developed Scalable Blog platform which achieved 98% accuracy in predictions. I've also contributed to Restaurant management system where I completed 2 months ahead of schedule. My technical expertise extends to SQL and Leadership. I'm passionate about CTO and continuously seek opportunities to innovate and lead high-performing teams. I'm excited to bring my experience and vision to your organization.",4,5,5,4,4.5,Excellent
107,"Hi, I'm Aisha, a MBA student from Hyderabad. I excel in Communication Skills, Leadership, and AWS. My portfolio includes three standout projects: Scalable Blog platform, where I reduced processing time by 50%, ML classification model which saved company $500K annually, and Inventory management system, delivering increased system efficiency by 40%. These experiences have solidified my expertise in REST APIs and Python. I'm passionate about collaborative problem-solving and have consistently delivered results that exceed expectations. My vision for the future is to work as a Principal Engineer, where I can drive innovation at scale and shape industry standards.",5,5,4,4,4.6,Excellent
108,"My name is Sanjay, and I'm a Civil Engineering student from Gurugram. With a comprehensive skill set including Java, Python, and Docker, I've successfully delivered transformative solutions. I led the development of Task management tool, which completed 2 months ahead of schedule. In parallel, I architected Scalable Blog platform which saved company $500K annually. My contributions to ML Weather forecasting app resulted in scaled system to handle 10x traffic, significantly impacting our organization. Beyond technical expertise, I've mentored junior developers and established best practices across teams. I'm proficient in Tableau and Kubernetes, ensuring robust and scalable solutions. My strategic vision aligns with becoming a Engineering Manager, where I can drive innovation and create lasting impact.",5,4,4,5,4.5,Excellent
109,"I'm Megha, a seasoned B.Tech in Mechanical Engineering based in Hyderabad. I have comprehensive expertise in REST APIs, Git, Leadership, and Excel. I've successfully delivered Mobile tracking application, achieving scaled system to handle 10x traffic, and Hospital management system, which increased system efficiency by 40%. My contribution to Restaurant management system resulted in established industry best practices. My technical arsenal includes TensorFlow, and I'm known for my ability to mentor and elevate team performance. I'm pursuing a Senior Software Engineer position to expand my leadership impact and drive transformative change.",5,5,5,4,4.85,Excellent
110,"Hello, I'm Siddharth, a MBA student from Gurugram. I have a strong foundation in REST APIs, Excel, and Communication Skills. Throughout my career, I've successfully led multiple impactful projects. My flagship project Hospital management system handled 100,000 daily active users and currently serves thousands of users. Additionally, I developed Data visualization dashboard which implemented enterprise-grade security standards. I've also contributed to ML classification model where I received 5-star reviews from stakeholders. My technical expertise extends to Python and Node.js. I'm passionate about Tech Lead and continuously seek opportunities to innovate and lead high-performing teams. I'm excited to bring my experience and vision to your organization.",5,4,4,5,4.5,Excellent
111,"I'm Rahul, a seasoned B.Tech in Civil Engineering based in Ahmedabad. I have comprehensive expertise in HTML/CSS, Tableau, Data Analysis, and Communication. I've successfully delivered IoT sensor network, achieving grew user base to 50,000 active users, and Customer analytics platform, which scaled system to handle 10x traffic. My contribution to Hospital management system resulted in optimized database performance by 60%. My technical arsenal includes Leadership, and I'm known for my ability to mentor and elevate team performance. I'm pursuing a VP Engineering position to expand my leadership impact and drive transformative change.",5,5,5,4,4.85,Excellent
112,"I'm Aisha, currently Product Manager in Pune. My professional expertise encompasses Node.js, Tableau, Android Development, and Scala. I've led the conception and deployment of IoT sensor network, achieving scaled system to handle 10x traffic. Simultaneously, I developed Recommendation engine, which received recognition and promotion. I also spearheaded Scalable Blog platform, resulting in increased system efficiency by 40%. My commitment to continuous learning has made me proficient in Leadership. I'm recognized for my ability to translate complex requirements into elegant solutions. My career objective is to become a Tech Lead, where I can scale my impact and mentor emerging talent.",5,5,4,4,4.6,Excellent
113,"My name is Anjali, and I'm a Masters in Business Administration from Pune. With a comprehensive skill set including JavaScript, Android Development, and Docker, I've successfully delivered transformative solutions. I led the development of Expense management system, which increased system efficiency by 40%. In parallel, I architected Real estate portal which optimized database performance by 60%. My contributions to Hospital management system resulted in handled 100,000 daily active users, significantly impacting our organization. Beyond technical expertise, I've mentored junior developers and established best practices across teams. I'm proficient in Scala and Data Analysis, ensuring robust and scalable solutions. My strategic vision aligns with becoming a Principal Engineer, where I can drive innovation and create lasting impact.",5,4,4,5,4.5,Excellent
114,"Hello, I'm Ravi, a Computer Science student from Mumbai. I have a strong foundation in Docker, Android Development, and Data Analysis. Throughout my career, I've successfully led multiple impactful projects. My flagship project Customer analytics platform optimized database performance by 60% and currently serves thousands of users. Additionally, I developed Recommendation engine which improved user experience significantly with 98% satisfaction. I've also contributed to Real estate portal where I grew user base to 50,000 active users. My technical expertise extends to HTML/CSS and SQL. I'm passionate about Machine Learning Lead and continuously seek opportunities to innovate and lead high-performing teams. I'm excited to bring my experience and vision to your organization.",4,5,5,4,4.5,Excellent
115,"Hi, I'm Pooja, a Product Manager from Mumbai. I excel in Problem Solving, Docker, and Machine Learning. My portfolio includes three standout projects: Data visualization dashboard, where I saved company $500K annually, Restaurant management system which handled 100,000 daily active users, and Real-time Chat application, delivering scaled system to handle 10x traffic. These experiences have solidified my expertise in HTML/CSS and Node.js. I'm passionate about collaborative problem-solving and have consistently delivered results that exceed expectations. My vision for the future is to work as a Solutions Architect, where I can drive innovation at scale and shape industry standards.",5,4,4,5,4.5,Excellent
116,"I'm Arjun, a MBA student based in Pune. My expertise spans Android Development, Docker, Agile, and React. I've spearheaded three major initiatives: Restaurant management system, which optimized database performance by 60%, Real-time Chat application, delivering grew user base to 50,000 active users, and Task management tool which improved user experience significantly with 98% satisfaction. Each project enhanced my capabilities and contributed to organizational growth. I'm skilled in Web Development and possess deep knowledge of industry best practices. My strategic approach to problem-solving has consistently driven measurable outcomes. I'm actively pursuing a role as a Director of Engineering, where I can leverage my experience to build exceptional products and lead transformative initiatives.",4,5,5,5,4.65,Excellent
117,"I'm Arjun, a seasoned B.Tech in Mechanical Engineering based in Hyderabad. I have comprehensive expertise in Excel, C++, Machine Learning, and Scala. I've successfully delivered Student management portal, achieving improved user experience significantly with 98% satisfaction, and Hospital management system, which implemented enterprise-grade security standards. My contribution to IoT sensor network resulted in achieved 98% accuracy in predictions. My technical arsenal includes Git, and I'm known for my ability to mentor and elevate team performance. I'm pursuing a Solutions Architect position to expand my leadership impact and drive transformative change.",4,5,5,4,4.5,Excellent
118,"My name is Megha. I'm a B.Tech in Electronics and Communication from Kolkata with deep expertise in C++, Communication Skills, and Excel. My career highlights include leading Data visualization dashboard which saved company $500K annually, architecting Task management tool that implemented enterprise-grade security standards, and spearheading ML classification model which optimized database performance by 60%. I bring additional competency in Project Management and React, ensuring comprehensive technical excellence. My approach combines technical rigor with strategic thinking. I'm committed to becoming a VP Engineering, where I can leverage my comprehensive skill set to drive organizational excellence and innovation.",5,4,4,5,4.5,Excellent
119,"Hello, I'm Aryan, a Business Analyst with consulting experience from Chennai. My professional expertise encompasses Kubernetes, Git, JavaScript, and Node.js. I've led the successful execution of Real-time Chat application, delivering increased system efficiency by 40%. I also architected Customer analytics platform, achieving received recognition and promotion, and spearheaded Real estate portal, which resulted in established industry best practices. Beyond technical skills, I'm proficient in Excel and skilled at building high-performing teams. My next career milestone is a role as a Principal Engineer, where I can drive strategic initiatives and create sustainable value.",5,5,5,4,4.85,Excellent
120,"I'm Aryan, a Civil Engineering student based in Delhi. My skillset includes Communication Skills, Problem Solving, HTML/CSS, and C++. I've successfully led ML Weather forecasting app, resulting in optimized database performance by 60%, and Supply chain management system, which reduced processing time by 50%. My work on Hospital management system delivered improved user experience significantly with 98% satisfaction. I'm additionally skilled in Node.js and possess a systematic approach to complex problem-solving. I'm driven to evolve into a Principal Engineer role, where I can apply my depth of experience to drive product excellence and organizational growth.",5,5,4,5,4.75,Excellent
121,"I'm Rahul, a Full Stack Developer based in Chennai. My expertise spans Machine Learning, Node.js, C++, and React. I've spearheaded three major initiatives: Real-time Chat application, which saved company $500K annually, ML Weather forecasting app, delivering scaled system to handle 10x traffic, and Recommendation engine which received 5-star reviews from stakeholders. Each project enhanced my capabilities and contributed to organizational growth. I'm skilled in Project Management and possess deep knowledge of industry best practices. My strategic approach to problem-solving has consistently driven measurable outcomes. I'm actively pursuing a role as a Solutions Architect, where I can leverage my experience to build exceptional products and lead transformative initiatives.",5,5,5,4,4.85,Excellent
122,"I'm Pooja, currently B.Tech in Mechanical Engineering in Hyderabad. My professional expertise encompasses Web Development, React, C++, and SQL. I've led the conception and deployment of Inventory management system, achieving grew user base to 50,000 active users. Simultaneously, I developed Mobile tracking application, which mentored 5+ junior developers. I also spearheaded IoT sensor network, resulting in completed 2 months ahead of schedule. My commitment to continuous learning has made me proficient in HTML/CSS. I'm recognized for my ability to translate complex requirements into elegant solutions. My career objective is to become a Tech Lead, where I can scale my impact and mentor emerging talent.",4,5,5,5,4.65,Excellent
123,"Hi, I'm Deepika, a Product Manager from Ahmedabad. I excel in Problem Solving, Leadership, and Android Development. My portfolio includes three standout projects: Restaurant management system, where I established industry best practices, Inventory management system which received 5-star reviews from stakeholders, and IoT sensor network, delivering saved company $500K annually. These experiences have solidified my expertise in Excel and Node.js. I'm passionate about collaborative problem-solving and have consistently delivered results that exceed expectations. My vision for the future is to work as a Director of Engineering, where I can drive innovation at scale and shape industry standards.",4,5,5,4,4.5,Excellent
124,"My name is Gaurav, and I'm a Electronics Engineering student from Delhi. With a comprehensive skill set including Statistics, Web Development, and Data Analysis, I've successfully delivered transformative solutions. I led the development of Customer analytics platform, which received 5-star reviews from stakeholders. In parallel, I architected Data visualization dashboard which handled 100,000 daily active users. My contributions to Web scraping tool resulted in optimized database performance by 60%, significantly impacting our organization. Beyond technical expertise, I've mentored junior developers and established best practices across teams. I'm proficient in Project Management and Node.js, ensuring robust and scalable solutions. My strategic vision aligns with becoming a Director of Engineering, where I can drive innovation and create lasting impact.",5,4,5,5,4.75,Excellent
125,"I'm Arjun, a seasoned Software Developer with 3 years experience based in Chennai. I have comprehensive expertise in TensorFlow, JavaScript, REST APIs, and Git. I've successfully delivered Data visualization dashboard, achieving increased system efficiency by 40%, and Music streaming platform, which scaled system to handle 10x traffic. My contribution to Supply chain management system resulted in mentored 5+ junior developers. My technical arsenal includes Scala, and I'm known for my ability to mentor and elevate team performance. I'm pursuing a Tech Lead position to expand my leadership impact and drive transformative change.",5,4,4,5,4.5,Excellent
126,"I'm Rahul, a seasoned Mechanical Engineering student based in Gurugram. I have comprehensive expertise in Problem Solving, Communication Skills, HTML/CSS, and Node.js. I've successfully delivered Task management tool, achieving increased system efficiency by 40%, and Real estate portal, which grew user base to 50,000 active users. My contribution to Expense management system resulted in received 5-star reviews from stakeholders. My technical arsenal includes Big Data, and I'm known for my ability to mentor and elevate team performance. I'm pursuing a Machine Learning Lead position to expand my leadership impact and drive transformative change.",4,5,5,4,4.5,Excellent
127,"I'm Ritika, currently Senior Data Analyst in Pune. My professional expertise encompasses Project Management, Java, Git, and Scala. I've led the conception and deployment of Supply chain management system, achieving handled 100,000 daily active users. Simultaneously, I developed Task management tool, which improved user experience significantly with 98% satisfaction. I also spearheaded Customer analytics platform, resulting in established industry best practices. My commitment to continuous learning has made me proficient in Android Development. I'm recognized for my ability to translate complex requirements into elegant solutions. My career objective is to become a Solutions Architect, where I can scale my impact and mentor emerging talent.",5,5,5,4,4.85,Excellent
128,"Hello, I'm Sanjay, a B.Tech in Civil Engineering with a track record of excellence in Ahmedabad. I've built strong proficiency in Leadership, Communication Skills, and Python. Over my career, I've successfully completed Enterprise E-commerce platform which optimized database performance by 60%, Recommendation engine resulting in received 5-star reviews from stakeholders, and Mobile tracking application which increased system efficiency by 40%. My work has consistently demonstrated value, earning recognition from stakeholders. I'm competent in Git and HTML/CSS, with a systematic approach to technical challenges. I'm enthusiastic about transitioning into a Tech Lead role, where I can apply my technical depth and leadership skills to drive strategic initiatives.",5,5,4,4,4.6,Excellent
129,"Hello, I'm Harsh, a Civil Engineering student from Kolkata. My professional expertise encompasses Communication, Kubernetes, REST APIs, and Leadership. I've led the successful execution of Data visualization dashboard, delivering established industry best practices. I also architected Real estate portal, achieving increased system efficiency by 40%, and spearheaded ML Weather forecasting app, which resulted in received 5-star reviews from stakeholders. Beyond technical skills, I'm proficient in SQL and skilled at building high-performing teams. My next career milestone is a role as a VP Engineering, where I can drive strategic initiatives and create sustainable value.",5,5,5,5,5.0,Excellent
130,"I'm Rahul, a MBA student based in Mumbai. My skillset includes C++, HTML/CSS, Data Analysis, and REST APIs. I've successfully led Scalable Blog platform, resulting in scaled system to handle 10x traffic, and IoT sensor network, which reduced processing time by 50%. My work on Real estate portal delivered implemented enterprise-grade security standards. I'm additionally skilled in Excel and possess a systematic approach to complex problem-solving. I'm driven to evolve into a Machine Learning Lead role, where I can apply my depth of experience to drive product excellence and organizational growth.",5,4,4,5,4.5,Excellent
131,"I'm Megha, a Computer Science student based in Delhi. My expertise spans Kubernetes, Web Development, Scala, and TensorFlow. I've spearheaded three major initiatives: Task management tool, which received 5-star reviews from stakeholders, Real-time Chat application, delivering achieved 98% accuracy in predictions, and IoT sensor network which scaled system to handle 10x traffic. Each project enhanced my capabilities and contributed to organizational growth. I'm skilled in React and possess deep knowledge of industry best practices. My strategic approach to problem-solving has consistently driven measurable outcomes. I'm actively pursuing a role as a Tech Lead, where I can leverage my experience to build exceptional products and lead transformative initiatives.",5,5,5,5,5.0,Excellent
132,"Hello, I'm Nisha, a Quality Assurance Lead from Delhi. I have a strong foundation in JavaScript, REST APIs, and Project Management. Throughout my career, I've successfully led multiple impactful projects. My flagship project Data visualization dashboard achieved 98% accuracy in predictions and currently serves thousands of users. Additionally, I developed IoT sensor network which improved user experience significantly with 98% satisfaction. I've also contributed to Expense management system where I mentored 5+ junior developers. My technical expertise extends to Leadership and Python. I'm passionate about Director of Engineering and continuously seek opportunities to innovate and lead high-performing teams. I'm excited to bring my experience and vision to your organization.",4,5,5,4,4.5,Excellent
133,"I'm Harsh, currently Associate Product Manager in Chennai. My professional expertise encompasses Kubernetes, Docker, Android Development, and Web Development. I've led the conception and deployment of Enterprise E-commerce platform, achieving received recognition and promotion. Simultaneously, I developed ML classification model, which grew user base to 50,000 active users. I also spearheaded ML Weather forecasting app, resulting in achieved 98% accuracy in predictions. My commitment to continuous learning has made me proficient in Leadership. I'm recognized for my ability to translate complex requirements into elegant solutions. My career objective is to become a CTO, where I can scale my impact and mentor emerging talent.",5,4,5,5,4.75,Excellent
134,"I'm Aisha, currently Recent graduate with internship experience in Pune. My professional expertise encompasses Machine Learning, Data Analysis, Statistics, and Java. I've led the conception and deployment of Task management tool, achieving grew user base to 50,000 active users. Simultaneously, I developed Data visualization dashboard, which mentored 5+ junior developers. I also spearheaded Web scraping tool, resulting in reduced processing time by 50%. My commitment to continuous learning has made me proficient in HTML/CSS. I'm recognized for my ability to translate complex requirements into elegant solutions. My career objective is to become a Senior Software Engineer, where I can scale my impact and mentor emerging talent.",5,5,5,5,5.0,Excellent
135,"Hi, I'm Manvi, a Product Manager from Hyderabad. I excel in Big Data, Kubernetes, and C++. My portfolio includes three standout projects: Student management portal, where I achieved 98% accuracy in predictions, Inventory management system which optimized database performance by 60%, and Customer analytics platform, delivering grew user base to 50,000 active users. These experiences have solidified my expertise in Agile and Tableau. I'm passionate about collaborative problem-solving and have consistently delivered results that exceed expectations. My vision for the future is to work as a Principal Engineer, where I can drive innovation at scale and shape industry standards.",5,4,5,5,4.75,Excellent
136,"I'm Sanjay, a MBA student based in Ahmedabad. My expertise spans Project Management, Machine Learning, Statistics, and REST APIs. I've spearheaded three major initiatives: Enterprise E-commerce platform, which mentored 5+ junior developers, Web scraping tool, delivering scaled system to handle 10x traffic, and Hospital management system which completed 2 months ahead of schedule. Each project enhanced my capabilities and contributed to organizational growth. I'm skilled in JavaScript and possess deep knowledge of industry best practices. My strategic approach to problem-solving has consistently driven measurable outcomes. I'm actively pursuing a role as a Principal Engineer, where I can leverage my experience to build exceptional products and lead transformative initiatives.",5,4,5,5,4.75,Excellent
137,"I'm Sanjay, a Senior Data Analyst based in Hyderabad. My expertise spans SQL, JavaScript, Tableau, and Kubernetes. I've spearheaded three major initiatives: Customer analytics platform, which improved user experience significantly with 98% satisfaction, Student management portal, delivering received recognition and promotion, and Hospital management system which scaled system to handle 10x traffic. Each project enhanced my capabilities and contributed to organizational growth. I'm skilled in Communication and possess deep knowledge of industry best practices. My strategic approach to problem-solving has consistently driven measurable outcomes. I'm actively pursuing a role as a Machine Learning Lead, where I can leverage my experience to build exceptional products and lead transformative initiatives.",5,5,5,4,4.85,Excellent
